{
 "schema_version": 1,
 "generated_at": "2026-10-24T05:42:35Z",
 "sec_aum_as_of": "2026-10-02",
 "deals": [
  {
   "cluster_id": 1035,
   "date": "2026-10-23T20:30:00Z",
   "headline": "ENERGY SERVICES OF AMERICA COMPLETES FAMCO ACQUISITION",
   "acquirer": {
    "name": "ENERGY SERVICES OF AMERICA",
    "slug": null,
    "crd": null
   },
   "target": {
    "name": "FAMCO",
    "slug": null,
    "crd": null
   },
   "target_aum_usd": null,
   "target_aum_source": null,
   "deal_type": "acquisition",
   "confidence": "high",
   "note": "",
   "stage": "completed",
   "value_usd": null,
   "industries": [
    "Energy & Utilities"
   ],
   "press_release": true,
   "sources": [
    {
     "name": "PR Newswire M&A",
     "url": "https://www.prnewswire.com/news-releases/energy-services-of-america-completes-famco-acquisition-302918424.html"
    }
   ]
  },
  {
   "cluster_id": 1036,
   "date": "2026-10-23T18:18:01Z",
   "headline": "Smith & Nephew was in discussions to merge with J&J unit, talks collapsed - FT",
   "acquirer": {
    "name": "Smith",
    "slug": null,
    "crd": null
   },
   "target": {
    "name": "Nephew",
    "slug": null,
    "crd": null
   },
   "target_aum_usd": null,
   "target_aum_source": null,
   "deal_type": "merger",
   "confidence": "high",
   "note": "",
   "stage": "terminated",
   "value_usd": null,
   "industries": [
    "Other"
   ],
   "press_release": false,
   "sources": [
    {
     "name": "Seeking Alpha M&A",
     "url": "https://seekingalpha.com/news/4656696-smith-and-nephew-was-in-discussions-to-merge-with-j-and-j-unit-talks-collapsed-ft?source=feed_tag_m_a"
    }
   ]
  },
  {
   "cluster_id": 1031,
   "date": "2026-10-23T16:18:02Z",
   "headline": "Oklahoma Landlord to Pay $52K for Violating Fair Housing Act",
   "acquirer": {
    "name": "Oklahoma Landlord",
    "slug": null,
    "crd": null
   },
   "target": {
    "name": "Violating Fair Housing Act",
    "slug": null,
    "crd": null
   },
   "target_aum_usd": null,
   "target_aum_source": null,
   "deal_type": "acquisition",
   "confidence": "high",
   "note": "",
   "stage": "announced",
   "value_usd": null,
   "industries": [
    "Insurance",
    "Real Estate"
   ],
   "press_release": false,
   "sources": [
    {
     "name": "Insurance Journal",
     "url": "https://www.insurancejournal.com/news/southcentral/2026/10/23/890193.htm"
    }
   ]
  },
  {
   "cluster_id": 1032,
   "date": "2026-10-23T16:00:00Z",
   "headline": "Everspan to sell its redundant admitted shell company to Falvey Insurance",
   "acquirer": {
    "name": "Falvey Insurance",
    "slug": null,
    "crd": null
   },
   "target": {
    "name": "Everspan’s redundant admitted shell company",
    "slug": null,
    "crd": null
   },
   "target_aum_usd": null,
   "target_aum_source": null,
   "deal_type": "acquisition",
   "confidence": "high",
   "note": "",
   "stage": "announced",
   "value_usd": null,
   "industries": [
    "Insurance",
    "Energy & Utilities"
   ],
   "press_release": false,
   "sources": [
    {
     "name": "Reinsurance News",
     "url": "https://www.reinsurancene.ws/everspan-to-sell-its-redundant-admitted-shell-company-to-falvey-insurance/"
    }
   ]
  },
  {
   "cluster_id": 1030,
   "date": "2026-10-23T13:00:48Z",
   "headline": "Midera Food Processing acquires Phoenix Innovations",
   "acquirer": {
    "name": "Midera Food Processing",
    "slug": null,
    "crd": null
   },
   "target": {
    "name": "Phoenix Innovations",
    "slug": null,
    "crd": null
   },
   "target_aum_usd": null,
   "target_aum_source": null,
   "deal_type": "acquisition",
   "confidence": "high",
   "note": "",
   "stage": "announced",
   "value_usd": null,
   "industries": [
    "Consumer & Retail"
   ],
   "press_release": false,
   "sources": [
    {
     "name": "Seeking Alpha M&A",
     "url": "https://seekingalpha.com/news/4656562-midera-food-processing-acquires-phoenix-innovations?source=feed_tag_m_a"
    }
   ]
  },
  {
   "cluster_id": 1029,
   "date": "2026-10-23T13:00:00Z",
   "headline": "WSG ACQUIRES SANCTUARY, POSITIONING THE CONTEMPORARY WOMEN'S BRAND FOR GLOBAL GROWTH",
   "acquirer": {
    "name": "WSG",
    "slug": null,
    "crd": null
   },
   "target": {
    "name": "SANCTUARY",
    "slug": null,
    "crd": null
   },
   "target_aum_usd": null,
   "target_aum_source": null,
   "deal_type": "acquisition",
   "confidence": "high",
   "note": "",
   "stage": "announced",
   "value_usd": null,
   "industries": [
    "Other"
   ],
   "press_release": true,
   "sources": [
    {
     "name": "PR Newswire M&A",
     "url": "https://www.prnewswire.com/news-releases/wsg-acquires-sanctuary-positioning-the-contemporary-womens-brand-for-global-growth-302917570.html"
    }
   ]
  },
  {
   "cluster_id": 1033,
   "date": "2026-10-23T07:00:00Z",
   "headline": "Gilead to pay $1.3B upfront for PepStar’s oral IL-23 challenger to J&J’s Icotyde",
   "acquirer": {
    "name": "Gilead",
    "slug": "gilead-capital-282023",
    "crd": "282023"
   },
   "target": {
    "name": "IL-23",
    "slug": null,
    "crd": null
   },
   "target_aum_usd": null,
   "target_aum_source": null,
   "deal_type": "acquisition",
   "confidence": "high",
   "note": "",
   "stage": "announced",
   "value_usd": 1300000000.0,
   "industries": [
    "Healthcare & Life Sciences"
   ],
   "press_release": false,
   "sources": [
    {
     "name": "Fierce Biotech",
     "url": "https://www.fiercebiotech.com/biotech/gilead-pay-13b-upfront-pepstars-oral-il-23-challenger-jjs-icotyde"
    }
   ]
  },
  {
   "cluster_id": 1024,
   "date": "2026-10-22T21:00:00Z",
   "headline": "Procede Software Announces Strategic Acquisition of RIMSS, Bringing Together Decades of Dealer Technology Leadership",
   "acquirer": {
    "name": "Procede Software",
    "slug": null,
    "crd": null
   },
   "target": {
    "name": "RIMSS",
    "slug": null,
    "crd": null
   },
   "target_aum_usd": null,
   "target_aum_source": null,
   "deal_type": "acquisition",
   "confidence": "high",
   "note": "",
   "stage": "announced",
   "value_usd": null,
   "industries": [
    "Technology"
   ],
   "press_release": true,
   "sources": [
    {
     "name": "PR Newswire M&A",
     "url": "https://www.prnewswire.com/news-releases/procede-software-announces-strategic-acquisition-of-rimss-bringing-together-decades-of-dealer-technology-leadership-302916018.html"
    }
   ]
  },
  {
   "cluster_id": 1025,
   "date": "2026-10-22T20:00:00Z",
   "headline": "Oridian Capital Partners-Backed ACR Acquires Ultra Green Packaging",
   "acquirer": {
    "name": "Oridian Capital Partners-Backed ACR",
    "slug": null,
    "crd": null
   },
   "target": {
    "name": "Ultra Green Packaging",
    "slug": null,
    "crd": null
   },
   "target_aum_usd": null,
   "target_aum_source": null,
   "deal_type": "acquisition",
   "confidence": "high",
   "note": "",
   "stage": "announced",
   "value_usd": null,
   "industries": [
    "Industrials"
   ],
   "press_release": true,
   "sources": [
    {
     "name": "PR Newswire M&A",
     "url": "https://www.prnewswire.com/news-releases/oridian-capital-partners-backed-acr-acquires-ultra-green-packaging-302917396.html"
    }
   ]
  },
  {
   "cluster_id": 1026,
   "date": "2026-10-22T19:21:00Z",
   "headline": "Amynta Group Completes Acquisition of Southern States Underwriters",
   "acquirer": {
    "name": "Amynta Group",
    "slug": null,
    "crd": null
   },
   "target": {
    "name": "Southern States Underwriters",
    "slug": null,
    "crd": null
   },
   "target_aum_usd": null,
   "target_aum_source": null,
   "deal_type": "acquisition",
   "confidence": "high",
   "note": "",
   "stage": "completed",
   "value_usd": null,
   "industries": [
    "Insurance"
   ],
   "press_release": true,
   "sources": [
    {
     "name": "PR Newswire M&A",
     "url": "https://www.prnewswire.com/news-releases/amynta-group-completes-acquisition-of-southern-states-underwriters-302917382.html"
    }
   ]
  },
  {
   "cluster_id": 1027,
   "date": "2026-10-22T17:59:00Z",
   "headline": "Harlem Children's Zone Acquires FinTech Platform, Goalsetter, to Accelerate Universal Economic Mobility",
   "acquirer": {
    "name": "Harlem Children's Zone",
    "slug": null,
    "crd": null
   },
   "target": {
    "name": null,
    "slug": null,
    "crd": null
   },
   "target_aum_usd": null,
   "target_aum_source": null,
   "deal_type": "acquisition",
   "confidence": "low",
   "note": "target not named in the headline",
   "stage": "announced",
   "value_usd": null,
   "industries": [
    "Fintech & Payments",
    "Industrials"
   ],
   "press_release": true,
   "sources": [
    {
     "name": "PR Newswire M&A",
     "url": "https://www.prnewswire.com/news-releases/harlem-childrens-zone-acquires-fintech-platform-goalsetter-to-accelerate-universal-economic-mobility-302917320.html"
    }
   ]
  },
  {
   "cluster_id": 1015,
   "date": "2026-10-22T17:41:14Z",
   "headline": "Datadog made offer to buy cloud cybersecurity startup Upwind - Information",
   "acquirer": {
    "name": null,
    "slug": null,
    "crd": null
   },
   "target": {
    "name": "Upwind",
    "slug": null,
    "crd": null
   },
   "target_aum_usd": null,
   "target_aum_source": null,
   "deal_type": "acquisition",
   "confidence": "low",
   "note": "acquirer not named in the headline",
   "stage": "bid",
   "value_usd": null,
   "industries": [
    "Technology"
   ],
   "press_release": false,
   "sources": [
    {
     "name": "Seeking Alpha M&A",
     "url": "https://seekingalpha.com/news/4656092-datadog-made-offer-to-buy-cloud-cybersecurity-startup-upwind---information?source=feed_tag_m_a"
    }
   ]
  },
  {
   "cluster_id": 1022,
   "date": "2026-10-22T16:24:10Z",
   "headline": "Risant Health to acquire Oklahoma system Integris Health",
   "acquirer": {
    "name": "Risant Health",
    "slug": null,
    "crd": null
   },
   "target": {
    "name": "Integris Health",
    "slug": null,
    "crd": null
   },